{
  "$schema": "https://json-schema.org/draft/2020-12/schema",
  "$id": "https://buaflow.dev/schemas/budget-evidence-v1.json",
  "title": "Buaflow budget evidence v1",
  "description": "What this app measured, with the command that produced each number and the file it came out of. Deliberately has no field for a threshold: the ceiling belongs to the application profile, so the same app passes or fails depending on what it claims to be rather than on a number it chose for itself.",
  "type": "object",
  "required": ["schemaVersion", "project", "generatedAt", "profile", "measurements"],
  "properties": {
    "$schema": { "type": "string" },
    "schemaVersion": { "const": "1.0" },
    "_": { "type": "string" },
    "project": { "type": "string", "minLength": 1 },
    "generatedAt": { "type": "string", "format": "date-time" },
    "profile": {
      "description": "The application profile id whose budgets apply. Changing it changes the bar without touching the app.",
      "type": "string",
      "pattern": "^[a-z][a-z0-9-]+$"
    },
    "measurements": {
      "type": "array",
      "minItems": 1,
      "items": { "$ref": "#/$defs/measurement" }
    }
  },
  "additionalProperties": false,
  "$defs": {
    "measurement": {
      "type": "object",
      "required": ["metric", "value", "command", "source"],
      "properties": {
        "metric": { "enum": ["domContentLoadedMs", "loadEventMs", "axeViolations", "axeSeriousOrCritical"] },
        "subject": {
          "description": "Which page or flow this number is about, so the worst one can be named.",
          "type": "string",
          "minLength": 1
        },
        "value": { "type": "number", "minimum": 0 },
        "command": {
          "description": "The repeatable command that produced the source file.",
          "type": "string",
          "minLength": 1
        },
        "source": {
          "type": "object",
          "required": ["type", "value"],
          "properties": {
            "type": { "const": "file" },
            "value": { "type": "string", "minLength": 1 }
          },
          "additionalProperties": false
        },
        "path": {
          "description": "Dot path to the number inside the source file, for timing metrics. Axe metrics are counted from the violations array instead.",
          "type": "string",
          "minLength": 1
        }
      },
      "additionalProperties": false
    }
  }
}
